{
  "$schema": "https://json-schema.org/draft/2020-12/schema",
  "type": "object",
  "additionalProperties": false,
  "required": ["id", "type", "events"],
  "properties": {
    "id": { "$ref": "#/$defs/item_id" },
    "type": { "enum": ["NEW", "BUG", "FEAT", "CHORE", "Q"] },
    "title": { "type": "string", "pattern": "^[^\\r\\n]*\\S[^\\r\\n]*$" },
    "theme": { "type": "string" },
    "priority": { "type": ["number", "string"] },
    "source": { "type": "string" },
    "source_ref": { "type": "string" },
    "legacy_id": { "type": "string" },
    "keep_because": { "type": "string" },
    "migration_note": { "type": "string" },
    "events": { "type": "array", "items": { "type": "object" } }
  },
  "$defs": {
    "item_id": { "type": "string", "pattern": "^[A-Z][A-Z0-9]{1,9}-[1-9]\\d*$" },
    "epic_id": { "type": "string", "pattern": "^(?!.*\\.\\.)[A-Za-z0-9][A-Za-z0-9._-]{0,99}$" },
    "commit": { "type": "string", "pattern": "^[0-9a-f]{7,64}$" },
    "at": {
      "type": "string",
      "pattern": "^\\d{4}-\\d{2}-\\d{2}(T\\d{2}:\\d{2}:\\d{2}(\\.\\d{1,3})?Z)?$"
    },
    "text": { "type": "string", "pattern": "\\S" },
    "value": { "type": ["string", "number", "null"] },
    "change": {
      "type": "object",
      "additionalProperties": false,
      "required": ["from", "to"],
      "properties": {
        "from": { "$ref": "#/$defs/value" },
        "to": { "$ref": "#/$defs/value" }
      }
    },
    "changes": {
      "type": "object",
      "additionalProperties": false,
      "properties": {
        "type": { "$ref": "#/$defs/change" },
        "title": { "$ref": "#/$defs/change" },
        "theme": { "$ref": "#/$defs/change" },
        "priority": { "$ref": "#/$defs/change" },
        "source": { "$ref": "#/$defs/change" },
        "source_ref": { "$ref": "#/$defs/change" },
        "legacy_id": { "$ref": "#/$defs/change" },
        "keep_because": { "$ref": "#/$defs/change" },
        "migration_note": { "$ref": "#/$defs/change" }
      }
    },
    "created": {
      "type": "object",
      "additionalProperties": false,
      "required": ["type", "at", "by"],
      "properties": {
        "type": { "const": "created" },
        "at": { "$ref": "#/$defs/at" },
        "by": { "$ref": "#/$defs/text" }
      }
    },
    "triaged": {
      "type": "object",
      "additionalProperties": false,
      "required": ["type", "at", "by"],
      "properties": {
        "type": { "const": "triaged" },
        "at": { "$ref": "#/$defs/at" },
        "by": { "$ref": "#/$defs/text" },
        "changes": { "$ref": "#/$defs/changes" }
      }
    },
    "queued": {
      "type": "object",
      "additionalProperties": false,
      "required": ["type", "at", "by", "epic"],
      "properties": {
        "type": { "const": "queued" },
        "at": { "$ref": "#/$defs/at" },
        "by": { "$ref": "#/$defs/text" },
        "epic": { "$ref": "#/$defs/epic_id" }
      }
    },
    "started": {
      "type": "object",
      "additionalProperties": false,
      "required": ["type", "at", "by", "epic"],
      "properties": {
        "type": { "const": "started" },
        "at": { "$ref": "#/$defs/at" },
        "by": { "$ref": "#/$defs/text" },
        "epic": { "$ref": "#/$defs/epic_id" }
      }
    },
    "close_requested": {
      "type": "object",
      "additionalProperties": false,
      "required": ["type", "at", "by", "reason", "proof"],
      "properties": {
        "type": { "const": "close_requested" },
        "at": { "$ref": "#/$defs/at" },
        "by": { "$ref": "#/$defs/text" },
        "reason": { "const": "fixed" },
        "proof": { "$ref": "#/$defs/commit" }
      }
    },
    "closed": {
      "type": "object",
      "additionalProperties": false,
      "required": ["type", "at", "by", "reason"],
      "properties": {
        "type": { "const": "closed" },
        "at": { "$ref": "#/$defs/at" },
        "by": { "$ref": "#/$defs/text" },
        "reason": { "enum": ["fixed", "stale", "wontdo", "dup", "rejected"] },
        "proof": { "$ref": "#/$defs/text" },
        "dup_of": { "$ref": "#/$defs/item_id" },
        "legacy": { "const": true }
      }
    },
    "reopened": {
      "type": "object",
      "additionalProperties": false,
      "required": ["type", "at", "by", "reason"],
      "properties": {
        "type": { "const": "reopened" },
        "at": { "$ref": "#/$defs/at" },
        "by": { "$ref": "#/$defs/text" },
        "reason": { "$ref": "#/$defs/text" }
      }
    },
    "edited": {
      "type": "object",
      "additionalProperties": false,
      "required": ["type", "at", "by", "changes"],
      "properties": {
        "type": { "const": "edited" },
        "at": { "$ref": "#/$defs/at" },
        "by": { "$ref": "#/$defs/text" },
        "changes": { "$ref": "#/$defs/changes" }
      }
    }
  }
}
