{
  "id": "SIG-238",
  "type": "Q",
  "title": "~~Is `AskUserQuestion` hookable?~~ — **ANSWERED YES, 2026-08-22, by running it**",
  "source": "migration:OPEN-QUESTIONS.md",
  "source_ref": "OPEN-QUESTIONS.md:9",
  "legacy_id": "OPEN-QUESTIONS.md:9",
  "events": [
    {
      "type": "created",
      "at": "2026-09-29",
      "by": "migration (v2)"
    },
    {
      "type": "closed",
      "at": "2026-09-29",
      "by": "migration",
      "reason": "fixed",
      "legacy": true
    }
  ]
}
