{
  "id": "SIG-219",
  "type": "FEAT",
  "title": "`/sig:goal` wrapper",
  "source": "migration:BACKLOG.md",
  "source_ref": "BACKLOG.md:2078",
  "legacy_id": "BACKLOG.md:2078",
  "events": [
    {
      "type": "created",
      "at": "2026-09-29",
      "by": "migration (v2)"
    },
    {
      "type": "triaged",
      "at": "2026-09-29",
      "by": "migration (v2)"
    }
  ]
}
