{
  "id": "SIG-309",
  "type": "BUG",
  "title": "Six Low findings from the security review of M6.E16 pass 4",
  "theme": "hygiene",
  "priority": "P3",
  "source": "M6.E16 REVIEW pass 4",
  "events": [
    {
      "type": "created",
      "at": "2026-10-13T15:26:40.277Z",
      "by": "claude (M6.E16 REVIEW)"
    },
    {
      "type": "triaged",
      "at": "2026-10-13T15:26:40.277Z",
      "by": "claude (M6.E16 REVIEW)"
    }
  ]
}
